{
  "meta": {
    "title": "GMIJ - Personal Portfolio",
    "description": "GMIJ's personal portfolio showcasing 15 years of .NET development experience, 5 years of management expertise, and contributions to open-source projects.",
    "keywords": "GMIJ, .NET, DevOps, TeamCity, open-source, software development, management, AI projects"
  },
  "header": {
    "name": "GMIJ",
    "tagline": "Experienced Developer and Manager",
    "subtitle": "15 years of .NET development, 5 years of management, and a passion for open-source contributions.",
    "stats": [
      {
        "number": "15+",
        "label": "Years of Development Experience"
      },
      {
        "number": "5+",
        "label": "Years of Management Experience"
      },
      {
        "number": "20+",
        "label": "R&D Team Members Managed"
      },
      {
        "number": "70+",
        "label": "Operations Team Members Managed"
      }
    ]
  },
  "about": {
    "title": "About Me",
    "items": [
      {
        "icon": "code",
        "title": "Development Expertise",
        "description": "15 years of .NET development experience (2002-2017). A full-stack engineer with a strong focus on clean code and regular refactoring."
      },
      {
        "icon": "settings",
        "title": "DevOps Knowledge",
        "description": "Proficient in DevOps practices, with expertise in using TeamCity for continuous integration and deployment."
      },
      {
        "icon": "management",
        "title": "Management Experience",
        "description": "5 years of management experience (2017-2023), including roles as R&D Director (20+ team members) and Operations Director (70+ on-site team members)."
      },
      {
        "icon": "growth",
        "title": "Achievements",
        "description": "Successfully increased annual operations contract value from 1M CNY to nearly 20M CNY through process improvements and team efficiency."
      }
    ]
  },
  "projects": {
    "title": "Projects",
    "leadTitle": "Projects I Lead",
    "contributorTitle": "Projects I Contribute To",
    "leadProjects": [
      {
        "name": "DynamicWallpaper",
        "badge": "AI-Powered",
        "description": "An AI-powered dynamic wallpaper project.",
        "github": "https://github.com/gmij/DynamicWallpaper",
        "website": "https://dw.gmij.win",
        "websiteLabel": "Wallpaper Wall"
      },
      {
        "name": "Audio3A_CSharp",
        "badge": "AI-Written",
        "description": "A .NET-native audio 3A processing SDK fully written by AI.",
        "github": "https://github.com/gmij/Audio3A_CSharp"
      },
      {
        "name": "Green Software Download Site",
        "badge": "AI-Written",
        "description": "A resource download site fully written by AI.",
        "github": "https://github.com/gmij/soft",
        "website": "https://soft.gmij.win",
        "websiteLabel": "Green Software Download Site"
      },
      {
        "name": "Children Image",
        "badge": "AI-Written",
        "description": "An AI-powered generator for children's hand-drawn posters.",
        "github": "https://github.com/gmij/children_image",
        "website": "https://img.gmij.win",
        "websiteLabel": "AI Children's Posters"
      },
      {
        "name": "ZerotierFix",
        "badge": "AI-Enhanced",
        "description": "An AI-enhanced ZeroTier Android client for personal VPN use.",
        "github": "https://github.com/gmij/ZerotierFix"
      }
    ],
    "contributorProjects": [
      {
        "name": "SmartSql",
        "badge": "Open Source",
        "description": "A lightweight, high-performance ORM for .NET.",
        "github": "https://github.com/dotnetcore/SmartSql"
      },
      {
        "name": "Ant Design Blazor",
        "badge": "Open Source",
        "description": "A Blazor implementation of Ant Design components.",
        "github": "https://github.com/ant-design-blazor/ant-design-blazor"
      }
    ]
  },
  "skills": {
    "title": "Skills",
    "categories": [
      {
        "name": "Development",
        "items": [
          ".NET",
          "Full-Stack Development",
          "Code Refactoring"
        ]
      },
      {
        "name": "DevOps",
        "items": [
          "TeamCity",
          "Continuous Integration",
          "Process Automation"
        ]
      },
      {
        "name": "Management",
        "items": [
          "Team Building",
          "R&D Efficiency Improvement",
          "Operations Management"
        ]
      }
    ]
  },
  "footer": {
    "copyright": "© 2023 GMIJ. All rights reserved.",
    "links": [
      {
        "label": "GitHub",
        "url": "https://github.com/gmij"
      },
      {
        "label": "DynamicWallpaper",
        "url": "https://dw.gmij.win"
      },
      {
        "label": "Green Software Download Site",
        "url": "https://soft.gmij.win"
      }
    ]
  },
  "ui": {
    "langButton": "Switch to Chinese",
    "githubLabel": "View on GitHub",
    "loading": "Loading..."
  }
}