{
  "meta": {
    "title": "GMIJ - 个人作品集",
    "description": "GMIJ 的个人作品集，展示了15年的.NET开发经验，5年的管理经验，以及开源项目的贡献。",
    "keywords": "GMIJ, .NET, DevOps, TeamCity, 开源, 软件开发, 管理, AI项目"
  },
  "header": {
    "name": "GMIJ",
    "tagline": "经验丰富的开发者与管理者",
    "subtitle": "15年.NET开发经验，5年管理经验，热衷于开源项目贡献。",
    "stats": [
      {
        "number": "15+",
        "label": "年开发经验"
      },
      {
        "number": "5+",
        "label": "年管理经验"
      },
      {
        "number": "20+",
        "label": "研发团队成员管理"
      },
      {
        "number": "70+",
        "label": "运维团队成员管理"
      }
    ]
  },
  "about": {
    "title": "关于我",
    "items": [
      {
        "icon": "code",
        "title": "开发专长",
        "description": "15年.NET开发经验（2002-2017）。全栈工程师，注重代码洁癖和定期重构。"
      },
      {
        "icon": "settings",
        "title": "DevOps 知识",
        "description": "熟练掌握DevOps相关知识，擅长使用TeamCity进行持续集成和部署。"
      },
      {
        "icon": "management",
        "title": "管理经验",
        "description": "5年管理经验（2017-2023），曾担任研发总监（20+人团队）和运维总监（70+驻场团队）。"
      },
      {
        "icon": "growth",
        "title": "成就",
        "description": "通过流程改进和团队效率提升，将年运维合同额从100万提升至近2000万人民币。"
      }
    ]
  },
  "projects": {
    "title": "项目",
    "leadTitle": "我主导的项目",
    "contributorTitle": "我参与的项目",
    "leadProjects": [
      {
        "name": "DynamicWallpaper",
        "badge": "AI驱动",
        "description": "一个AI驱动的动态壁纸项目。",
        "github": "https://github.com/gmij/DynamicWallpaper",
        "website": "https://dw.gmij.win",
        "websiteLabel": "壁纸墙"
      },
      {
        "name": "Audio3A_CSharp",
        "badge": "AI编写",
        "description": "一个完全由AI编写的.NET原生音频3A处理SDK。",
        "github": "https://github.com/gmij/Audio3A_CSharp"
      },
      {
        "name": "绿色软件下载站",
        "badge": "AI编写",
        "description": "一个完全由AI编写的资源下载站。",
        "github": "https://github.com/gmij/soft",
        "website": "https://soft.gmij.win",
        "websiteLabel": "绿色软件下载站"
      },
      {
        "name": "Ai幼画",
        "badge": "AI编写",
        "description": "一个完全由AI编写的儿童手抄报生成器。",
        "github": "https://github.com/gmij/children_image",
        "website": "https://img.gmij.win",
        "websiteLabel": "AI幼画"
      },
      {
        "name": "ZerotierFix",
        "badge": "AI完善",
        "description": "一个完全由AI完善的ZeroTier安卓客户端，用于个人VPN。",
        "github": "https://github.com/gmij/ZerotierFix"
      }
    ],
    "contributorProjects": [
      {
        "name": "SmartSql",
        "badge": "开源项目",
        "description": "一个轻量级、高性能的.NET ORM框架。",
        "github": "https://github.com/dotnetcore/SmartSql"
      },
      {
        "name": "Ant Design Blazor",
        "badge": "开源项目",
        "description": "一个Ant Design组件的Blazor实现。",
        "github": "https://github.com/ant-design-blazor/ant-design-blazor"
      }
    ]
  },
  "skills": {
    "title": "技能",
    "categories": [
      {
        "name": "开发",
        "items": [
          ".NET",
          "全栈开发",
          "代码重构"
        ]
      },
      {
        "name": "DevOps",
        "items": [
          "TeamCity",
          "持续集成",
          "流程自动化"
        ]
      },
      {
        "name": "管理",
        "items": [
          "团队组建",
          "研发效能改进",
          "运维管理"
        ]
      }
    ]
  },
  "footer": {
    "copyright": "© 2023 GMIJ. 版权所有。",
    "links": [
      {
        "label": "GitHub",
        "url": "https://github.com/gmij"
      },
      {
        "label": "壁纸墙",
        "url": "https://dw.gmij.win"
      },
      {
        "label": "绿色软件下载站",
        "url": "https://soft.gmij.win"
      }
    ]
  },
  "ui": {
    "langButton": "切换到英文",
    "githubLabel": "在 GitHub 上查看",
    "loading": "加载中..."
  }
}